Comment_ID,Post_ID,Comment_Text,Comment_Date,Comment
223567890_12,223567890,莫德納跟輝瑞有90幾% AZ打完第二劑 保護力有81% 目前市面上其他疫苗，保護力大約在50～90%之間 有說國產疫苗至少要高於AZ的保護力，安全性高，副作用比較少的樣子，但實際保護力到達多少，還是需要時間來驗證吧！ 如果保護力數據不錯，又沒什麼副作用，倒是可以考慮，不過目前比較看好聯亞的疫苗 台灣已經很強了！這麼小一個國家研發疫苗 這就跟糧食一樣，買糧食進口比較便宜，何必要自己種，但哪天糧食危機，人人自危誰管你呢 ～留點後路還是比較好，至於效果，就看後續吧！,2021-6-10,"Modner and Pfizer have 90% AZ after the second dose of protection and 81%. At present, other vaccines on the market are currently on the market. The protection power is about 50-90%. It looks like high sexual and has less side effects, but how much actual protection can reach, it still takes time to verify! If the protection data is good and there are no side effects, it can be considered, but it is more optimistic about the vaccine in Lianya. Taiwan is already very strong! Such a small country develops vaccines. This is the same as food. It is cheaper to buy food imports. Why do you need to grow yourself? Look at the follow -up!"
223567890_13,223567890,"嬌生的是 adenovirus type 26 (Ad26) vector
AZ的是replication-deficient simian adenovirus vector
不同的Vector帶有的promoter不會一樣，所以最後產出來的蛋白質含量也不會一樣
這個問題很細膩，算是商業機密。",2021-6-10,"The spoiled is Adenovirus Type 26 (AD26) Vector
AZ's Replication Simian Adenovirus Vector
Different vectors are not the same with the Promoter, so the protein content produced in the end will not be the same
This problem is very delicate, which is a commercial secret."
223567890_14,223567890,政治真的害人不淺 不過理性來說也不是每個人都有能力去讀這些文獻啦，就算英文能力沒問題，這類的科學文獻如果不是相關領域的人也不是馬上就能看懂的 即使我讀生科的但研究領域不同在看這些文獻也是要一直google那些專有名詞和技術是怎麼做的（微免學的直接還給老師 要期許一般民眾能看懂或許還是得有人來用比較簡單易懂的文字說明 當然最大的問題還是現在的人寧可一上來就開砲跟人吵架也不願意花時間好好讀一篇文章了……,2021-6-10,"Politics is really harmful, but rationality does not have the ability to read these documents. Even if the English ability is okay, such scientific literatures can not be understood if people in related fields are not in related fields. Even if people are not in related fields. I read the students but the fields of research are different. When reading these documents, I have to google how to do the proper nouns and technologies (the micro -learning is directly given to the teacher. The simple and easy -to -understand text description is of course the biggest problem is that now the people would rather fire with people as soon as they came up."
223567890_15,223567890,我媽打完第二劑了 沒什麼副作用 可是他打第一劑的時候除了打完那天 打針手臂的地方稍微痠痛 然後第二天就沒事了,2021-6-10,"My mother has finished the second dose, there is no side effect, but when he played the first dose, except for the injection arms that day was slightly sore and the next day was okay."
223567890_16,223567890,拜託別再說AZ保護力只有70%了...打完第二劑是有到80幾%的，不要讓大家覺得AZ比其他兩種疫苗「爛很多」 上次還看到說近期數據有AZ防護力88%,2021-6-10,"Please don't say that AZ's protection is only 70%... There are more than 80%of the second dose after playing. Don't let everyone think that AZ is ""much worsen"" than the other two vaccines than the other two vaccines. Protection 88%"
223567890_17,223567890,保護率的定義是只是會有症狀，但其實各疫苗在避免死亡率跟不可逆重症的機率是百分之99.9，或許大家都很不喜歡az 甚至國產疫苗，但我們要選擇的應該是如何保護好自己的生命吧？,2021-6-10,"The definition of the protection rate is that there will be symptoms, but in fact, the chance of each vaccine is 99.9 percent of the risk of avoiding mortality and irreversible severe illnesses. Maybe everyone doesn't like AZ or even domestic vaccines, but what we want to choose should be protected. Your own life?"
223567890_18,223567890,總共只有這幾個國家有研發疫苗 台灣也太強了吧 如果真的七月研發成功 還可以幫助國外其他疫情嚴重的國家,2021-6-10,"In total, only these countries have research and development vaccines in Taiwan."
223567890_19,223567890,台灣真的都是挑別人不要的買欸 真的厲害！佩服！ 有便宜 有認證 上市的疫苗 不用！ 用貴的 沒有認證的 還在研發的疫苗！ 當我們人民凱子是不是啊？,2021-6-10,Taiwan is really really powerful to pick others! admire! There is no need for cheap and certified vaccines! Vaccine that is still developing with no authentication! Are our people Kaizi?
223567890_20,223567890,打完AZ 跟沒打一樣 一點症狀都沒有 同事發燒的發燒 倒的倒⋯我身體也太差了吧,2021-6-10,"After playing AZ, there is no symptoms as no symptoms. There is no colleague who has a fever. My body is too bad."
223567890_21,223567890,只想打BNT +1 對變種抵抗力比較強的只剩BNT跟嬌生了吧,2021-6-10,I just want to play BNT +1 that only BNT and Jiao are born with strong resistance to variants.
223567890_22,223567890,一月底打了BNT 第一劑除了施打部位肌肉痠痛以及腿部肌肉快爆炸之外沒其他感覺 第二劑完全沒事 室友三月打了Az 第一劑發燒兩天全身痠痛然後就沒事了 第二劑體溫輕微上升無其他症狀,2021-6-10,"At the end of January, the BNT first dose was except for the muscle soreness of the area and the leg muscles were fast explosion. There was no other sensation. The second dose was all right. The temperature of the agent has no other symptoms without other symptoms"
223567890_23,223567890,高瑞 09年生產研發H1N1及H5N1疫苗 12年進行一階臨床 14年進行腸病毒二階臨床 15年H7N9臨床 16年登革熱疫苗研發製造生產銷售17國 這叫做新興公司 那中國香港韓國日本打了BNT的死亡可以忽略不計？ 台灣的醫病比在常態下是逼近1：16 國際普遍是1：8 中國是1：10 那台灣有多少人力可以負擔普篩，真要說入境篩是可以負荷的但中央地方不願意，高瑞與政商脫不了關係的，國民兩黨都有參與,2021-6-10,"Gao Rui produced and developed H1N1 and H5N1 vaccines in 2009 for 12 years for first -order clinical entertainment second -order clinical 15 -year clinical H7N9 clinical 16 years of thermal vaccine, R & D, manufacturing and sales, and production and sales of 17 countries. Can death be ignored? Taiwan's medical treatment is close to 1:16 in the normal state that is generally 1: 8 China is 1:10. How much manpower in Taiwan can afford the general sieve. It really wants to say that entry screening can be load Rui and political and business cannot get rid of the relationship."
223567890_24,223567890,我是不信不安全東西，不有效的東西，中研院生醫所的林宜玲老師會讓他過關，假如硬通過出問題，我跟你講，DPP絕對完蛋！他們不會繼續在台灣政壇上統治台灣，因為這種糟蹋人民生命財產安全的行為，就是政治殺人，我去年也投給蔡英文，我他媽現在就是不爽沒有能力位居高位無所作為，KMT是親中沒錯，韓國瑜是草包沒錯，但政治不是在比爛欸……台灣都快被藍綠搞垮了，追求卓越都是用嘴巴講講而已，跟本做不到，錢和利益永遠擺第一，整天玩台灣獨立都快變成國際孤兒，到底是面子重要還是人命重要？想一想吧！,2021-6-10,"I do n’t believe it, unsafe, and not effective. Teacher Lin Yiling of the Institute of Biomedicine of the Chinese Academy of Sciences will let him pass. If you have a problem, I will tell you that DPP is absolutely finished! They will not continue to rule Taiwan in Taiwan's politics, because this kind of behavior that ruins the lives and property of the people is political killing. I also voted for Tsai Ing -wen last year. That's right, South Korea ’s Yu is a grass bag, but politics is not better than rotten ... Taiwan is almost broken by blue and green. Pursuing excellence is just talking with his mouth. First, playing Taiwan ’s independence all day is about to become an international orphan. Is it important to face or life? Think about it!"
223567890_25,223567890,我是不信不安全東西，不有效的東西，中研院生醫所的林宜玲老師會讓他過關，假如硬通過出問題，我跟你講，DPP絕對完蛋！他們不會繼續在台灣政壇上統治台灣，因為這種糟蹋人民生命財產安全的行為，就是政治殺人，我去年也投給蔡英文，我他媽現在就是不爽沒有能力位居高位無所作為，KMT是親中沒錯，韓國瑜是草包沒錯，但政治不是在比爛欸……台灣都快被藍綠搞垮了，追求卓越都是用嘴巴講講而已，跟本做不到，錢和利益永遠擺第一，整天玩台灣獨立都快變成國際孤兒，到底是面子重要還是人命重要？想一想吧！,2021-6-11,"I do n’t believe it, unsafe, and not effective. Teacher Lin Yiling of the Institute of Biomedicine of the Chinese Academy of Sciences will let him pass. If you have a problem, I will tell you that DPP is absolutely finished! They will not continue to rule Taiwan in Taiwan's politics, because this kind of behavior that ruins the lives and property of the people is political killing. I also voted for Tsai Ing -wen last year. That's right, South Korea ’s Yu is a grass bag, but politics is not better than rotten ... Taiwan is almost broken by blue and green. Pursuing excellence is just talking with his mouth. First, playing Taiwan ’s independence all day is about to become an international orphan. Is it important to face or life? Think about it!"
223567890_26,223567890,不是國產多差的問題 是政府為了護國產不願意大量採購疫苗 好像人民的生命不如股價 還有 如果真的打國產 有疫苗護照的需求的人民呢？要怎麼負責⋯B69,2021-6-11,The problem that is not the difference in domestic production is that the government is unwilling to purchase a large number of vaccines in order to protect domestic production. It seems that the people's lives are not as good as the stock price. If the people who really have domestic vaccine passports are really needed? How to be responsible for ... B69
223567890_27,223567890,美國生技公司諾瓦瓦克斯（Novavax）研發採用次蛋白技術的新冠肺炎疫苗，最快今年夏天可供應施打。 台灣高端和聯亞研發的疫苗也都是採用次蛋白技術。 國產不一定比較差 但國人都沒信心,2021-6-11,"US biotechnology company Novavax developed a new crown pneumonia vaccine with subrillet technology, which can be supplied as soon as this summer. The vaccines developed by Taiwan's high -end and Lianya also adopt secondary protein technology. Domestic production is not necessarily poor, but Chinese people are not confident"
223567890_28,223567890,我也是最近打完az 我打完沒有什麼副作用，只是手臂腫了兩天～,2021-6-11,"I have also finished playing AZ recently. I have no side effects after playing, but my arms have been swollen for two days ~"
223567890_29,223567890,"臺灣自己研發了疫苗 現在目前數據不是那真的都不錯
最後成功的的話那真的很厲害欸",2021-6-11,"Taiwan has developed the vaccine by myself. Now the data is not really good.
If the last successful, then it is really amazing 欸"
223567890_30,223567890,"ovavax 從年初開始進行三期試驗 有上萬人的數據 保護力約89% 但至今仍無法取得EUA
我是不認為Novavax會比高端差啦 連他都要做這麼久的三期試驗 高端現在剛二期解盲 等到取得EUA 可能都要明年了吧 希望我們能活到那個時候(⁎⁍̴̛ᴗ⁍̴̛⁎)",2021-6-11,"OVAVAX has conducted about 89% of the data protection of tens of thousands of people from the beginning of the year, but still cannot obtain EUA so far
I don’t think that Novavax will be worse than the high -end, even he has done so long test high -end high -end now the second phase of the second phase, wait until the EUA may be obtained, I hope we can live at that time (⁎⁍̴̛ᴗ⁍̴̛ ⁎⁍̴̛ᴗ⁍̴̛ ⁎⁍̴̛ᴗ⁍̴̛ (⁎⁍̴̛ᴗ⁍̴̛ ⁎⁍̴̛ᴗ⁍̴̛ ⁎⁍̴̛ᴗ⁍̴̛ 我⁎)"
223567890_31,223567890,"有沒有人知道為什麼嬌生只要一劑啊？
都腺病類AZ卻要2劑",2021-6-11,"Does anyone know why Jiao Sheng only needs one dose?
Gonneys AZ requires 2 doses"
223567890_32,223567890,"我是熱火的
我不知道內幕但我就覺得高端=低端",2021-6-11,"I am a hot
I don't know the inside story, but I think high -end = low -end"
223567890_33,223567890,"一線人員
已打完Az
發燒 頭痛 三天內症狀完畢
後續沒有症狀",2021-6-11,"First -line personnel
Has been finished AZ
Fever headache and headache within three days is complete
There is no symptom after follow -up"
223567890_34,223567890,每個疫苗都有副作用，每個也都有接種疫苗後因副作用過世，哪支疫苗比較好不過媒體過度炒作,2021-6-11,"Each vaccine has side effects, and each has a side effect after vaccination. Which vaccine is better than the media over -speculation."
223567890_35,223567890,看好了台灣 世界都在漸漸恢復正常生活 而我們連疫苗都不能打 喔說錯了 是不能打好的疫苗 只能打國產幫黨賺錢錢,2021-6-11,"I am optimistic that the Taiwan world is gradually returning to normal life. We can't even fight the vaccine. If you say something wrong, you can only fight the party to help the party to make money."
223567890_36,223567890,保守估計要10月以後吧～ 不然陳培哲老師為何要請辭，三期臨床試驗AZ可是做了四萬人，我是覺得二期3700多人的數據假如不是造假，已經可以先拿來打疫苗了。,2021-6-11,"It is conservatively estimated that after October ~ Otherwise, why did Teacher Chen Peizhe resign? The third phase of the clinical trial AZ did 40,000 people. I think that if the data of more than 3,700 people in the second phase of the second phase is not fraud, I can already use the vaccine first."
223567890_37,223567890,"不用選，我只買保險
不會施打
死了把錢留給親人
沒死就繼續普通人生活

真的不要糾結疫苗這件事
應該想想如何把眼前糟糕的狀況填補好",2021-6-11,"No need to choose, I only buy insurance
Will not fight
Leave the money to your loved ones when you die
Continue life without death

Really don't tangled the vaccine
You should think about how to fill the bad situation in front of you"
223567890_38,223567890,"嗨 我

第一針就是那種全部副作用都有 而且感覺快死了：全身無力 沒食慾 真的只能在床上 （記得準備一天糧食因為真的會沒力氣動）

第二針就是完全沒感覺 

對了
我朋友上週一跟我見面 他只打第一針還沒第二針
結果週四開始不舒服 然後用我們英國這邊的在家檢測包測出陽性到今天都還是
他跟我說就是全身不舒服酸痛然後小發燒這樣

至少我覺得AZ, Pfizer, Moderna 都好因為這個月歐盟已經擬定疫苗護照了 可能再過不久我們就可以自由進出了

供參考

台灣的大家加油吧💪🏼",2021-6-11,"Me

The first needle is the kind of side effects and it feels like dying: The whole body is weak and has no appetite. I can only be on the bed (remember to prepare for a day of food, because it will really have no strength to move)

The second needle is that it doesn't feel at all

correct
My friend met me last Monday and he only got the first needle.
As a result, I started to be uncomfortable on Thursday.
He told me that he was uncomfortable with the whole body and soreness and then a small fever.

At least I think AZ, PFIZER, Moderna is good because the European Union has developed vaccine passports this month.

for reference

Come on, everyone in Taiwan 加 加 加 加"
223567890_39,223567890,"並非購買塞車好嗎，佛光山跟嬌生談採購，嬌生說要跟政府談；郭董已經說要捐500萬BNT疫苗，全都被某人卡關好嗎！！！！！！別在只看三民自了，多看看其他家的新聞！！！
昨天高端解盲，並不代表完全就可施打，而且高端以前有生產過任何疫苗嗎？沒有！！！
而且高端目前只有二期實驗，國外不管是輝瑞、莫德納、AZ、史普尼克5號，都有三期實驗數據才有EUA！

二期疫苗怎麼能跟三期比？？？
說什麼AZ疫苗會消化不完，廢話！！！！國外一堆打了出現血栓，誰要打！！！！
台灣都是拿人家不要的疫苗！！！！韓國給AZ，日本也給AZ
美國說要給75萬劑，When?Where?

每次記者會說第幾季會有多少進來，結果勒？東西在哪裡？就算有進來，進的量也跟說好的數量差距超大！！！阿當初買疫苗的錢到底都去哪了？？？？

當初專家建議全民普篩，就是要確保國內民眾沒有染疫的破口，不要！！！
染疫要求公佈足跡，不要！！！！說會造成恐慌，笑話！！！不全部公佈更容易恐慌！！！！
台灣民眾出國被檢出染疫，說他們的檢測試劑不準！！！但…………檢測試劑是台灣生產欸！！！！

台灣生產的檢測試劑不準國內使用，只準出口國外！？？？
台灣口罩當初徵收時成本價1元，卻賣民眾8塊錢！！！！
當時自家民眾都買不到口罩，還要帶著口罩大外宣說TAIWAN CAN HELP，難怪人家要errrrrrrrrrr",2021-6-11,"Isn't it buying a traffic jam? Foguangshan talked about purchasing with Jiao Sheng, and Jiao Sheng said to talk to the government; Guo Dong has said that he wants to donate 5 million BNT vaccines, is it all stuck by someone! Intersection Intersection Intersection Intersection Intersection Don't just look at the three people, and look at the news of other homes! Intersection Intersection
Yesterday, high -end blindness dismissal does not mean that it can be fully beaten, and has the high -end producing any vaccine before? No! Intersection Intersection
Moreover, there are only second -phase experiments at the current high -end. Whether it is Pfizer, Modner, AZ, and Spenik 5, there are three -phase experimental data to have EUA!

How can the second phase of the vaccine compare with the third phase? Intersection Intersection
What does AZ vaccine can't be digested and nonsense! Intersection Intersection Intersection A bunch of abroad have a thrombosis, who wants to fight! Intersection Intersection Intersection
Taiwan takes the vaccine that people do not want! Intersection Intersection Intersection South Korea gives AZ, and Japan also gives AZ
The United States says to give 750,000 doses, when? Where?

Every time a press conference said, how many season will come in, but the result? Where is the thing? Even if there are, the amount of entry is very different from the number of talks! Intersection Intersection Where did the money buy the vaccine at first? Intersection Intersection Intersection

At that time, experts suggested that the whole people ’s general screening is to ensure that domestic people have no break in infection, do n’t! Intersection Intersection
The infection requires the announcement of the footprint, don't! Intersection Intersection Intersection It will cause panic, joke! Intersection Intersection It's easier to panic! Intersection Intersection Intersection
The people in Taiwan were detected to be found out abroad, saying that their test reagents were not allowed! Intersection Intersection But .......... The detection reagent is produced in Taiwan! Intersection Intersection Intersection

Detective reagents produced in Taiwan are not allowed to be used in China, but only exported abroad! Intersection Intersection Intersection
The cost price at the time of the Taiwan mask was 1 yuan, but it sold for 8 yuan! Intersection Intersection Intersection
At that time, their own people couldn't buy a mask, and they had to bring a mask to declare taiwan can Help."
223567890_40,223567890,"自己排序很後面
嗯…可以報名自願先打國產疫苗嗎？
（舉手）",2021-6-11,"Sort yourself very behind
Hmm ... Can I sign up to voluntarily get domestic vaccines?
(Raise your hand)"
223567890_41,223567890,現在怎麼沒有人去該說病毒是誰害的???????????????  應該一部分的人去追疫苗一部份去追病毒是誰害的阿,2021-6-11,Now why no one should say who should say that the virus is harmful ?????????????????? Should pursue one part of the vaccine who pursue the virus.
223567890_42,223567890,至於說到大量採購的問題，五月爆發以前，疫苗，真的根本沒人要打啊！四月的時候，還要求人來打免得有餘棄量的問題。疫苗保存也不是隨便找冰箱放，一會兒一天不到50人打，疫苗放到快過期，突然變成一天幾千幾萬人要打。每次說到疫苗採購，一會兒都說不要打，一會兒說不夠打，所以到底是⋯？！昏倒。,2021-6-11,"As for the problem of a large number of procurement, before the outbreak of May, the vaccine, no one really wanted to fight! In April, people also asked people to have a problem of abandonment. The vaccine preservation is not to find the refrigerator casually. In less than 50 people a day, the vaccine is about to expire, and suddenly it becomes tens of thousands of people a day. Every time I talk about the vaccine purchase, I said not to fight for a while, and I said it was not enough, so is it? Intersection faint."
223567890_43,223567890,那3700人的臨床試驗是做假的？ 如果是真的，為什麼不能打？你要不要好好想一個 defense 大家的理由。,2021-6-11,"Which clinical trials of 3700 people are fake? If it is true, why not fight? Do you want to think of a reason for Defense."
223567890_44,223567890,"B174，如果這篇結論是真的，那D614G還比較容易被中和，換句話說意思是國產能夠對抗英國變種病毒株D614G，但台灣可能面臨的情況有：
1. CCR 英國台灣變種株
2. 張上淳院長一直沒有給我們看定序原始結果的300株英國變種株的完整序列是否有印度變種病毒株，因為前陣子有印度專機回台灣
3. 南非變種病毒株N501Y剛好會讓antibody binding site改掉，所以中和能力變很差。 
不能保證在台灣沒有南非變種株，因為台灣一直有境外移入的個案，有沒有去過南非的人，我們無從得知。",2021-6-11,"B174, if this conclusion is true, then D614G is relatively easy to be neutralized.
1. CCR British Taiwan variant plant
2. Dean Zhang Shangchun has never given us the complete sequence of the 300 British variants of the original result of the original results of the original results. Is there an Indian variant virus strain?
3. South African variant virus strains N501Y will just make Antibody Binding sit, so neutralization has worse.
There are no South African variants in Taiwan, because Taiwan has always been moved in overseas. We have no way to know whether there are people who have been to South Africa."
223567890_45,223567890,莫德納肩膀酸兩天,2021-6-11,Modner's shoulder is sour for two days
223567890_46,223567890,誰想打國產啦，現在是要強迫打這個了嗎？為什麼我們不能有選擇！,2021-6-11,"Who wants to hit domestic, is it going to force this now? Why can't we have a choice!"
223567890_47,223567890,"路過......
目前工作的醫院開始在施打莫德納了呢
但大部分的人都打AZ

我的同事
第一劑AZ大部分隔天無法來上班，發高燒
我本身全身無力，很難受、疲倦

第二劑
大部分的人沒什麼感覺，都照常來上班
我自己注射處疼痛了至少兩天，體溫維持37度以上至少2天

其他沒太大的感受",2021-6-11,"Passing ...
The current work hospital is starting to hit Modner
But most people play AZ

My colleague
The first dose AZ can not come to work the next day, high fever high fever
I am weak and uncomfortable, tired and tired

Second dose
Most people don't feel much, they come to work as usual as usual
I have pain at least two days by myself, and my body temperature is maintained by 37 degrees or more at least 2 days

There is not much other feelings"
223567890_48,223567890,"目前印度爆開，政府進口也搞不定，真的是沒得選
但怎麼講的國產多差的感覺⋯目前數據跟科學支撐都還行吧？只差第三期防護力實驗欸",2021-6-11,"At present, India is exploding, and the government's imports are unsure. I really don’t have to choose.
But how do you say the difference in domestic production? At present, the data and scientific support are okay? Only the third phase of the protective power experiment 只"
